{
    "thread": {
        "uuid": "da6d6f2e46f9545f80a2e5404534f43439f3a87a",
        "url": "https://www.wilx.com/2024/05/09/4th-tornado-confirmed-tuesdays-storms",
        "site_full": "www.wilx.com",
        "site": "wilx.com",
        "site_section": "https://www.wilx.com",
        "site_categories": [
            "media"
        ],
        "section_title": "Homepage",
        "title": "National Weather Service confirms 4th tornado touched down from Tuesdays storms",
        "title_full": "National Weather Service confirms 4th tornado touched down from Tuesdays storms",
        "published": "2024-05-09T23:43:00.000+03:00",
        "replies_count": 0,
        "participants_count": 1,
        "site_type": "news",
        "country": "US",
        "main_image": "https://gray-wilx-prod.cdn.arcpublishing.com/resizer/v2/P7H4CSIAINBZ5AJLKKL33AXZJY.png?auth=15f2c3b263d438f05af2ba6e30f66f1cbaac1cf8b397fc703aa3e9ee372f48e3&amp;width=1200&amp;height=600&amp;smart=true",
        "performance_score": 0,
        "domain_rank": 21279,
        "domain_rank_updated": "2024-05-07T13:07:48.000+03:00",
        "reach": null,
        "social": {
            "facebook": {
                "likes": 0,
                "comments": 0,
                "shares": 0
            },
            "gplus": {
                "shares": 0
            },
            "pinterest": {
                "shares": 0
            },
            "linkedin": {
                "shares": 0
            },
            "stumbledupon": {
                "shares": 0
            },
            "vk": {
                "shares": 0
            }
        }
    },
    "uuid": "da6d6f2e46f9545f80a2e5404534f43439f3a87a",
    "url": "https://www.wilx.com/2024/05/09/4th-tornado-confirmed-tuesdays-storms",
    "ord_in_thread": 0,
    "parent_url": null,
    "author": "@wilxTV",
    "published": "2024-05-09T23:43:00.000+03:00",
    "title": "National Weather Service confirms 4th tornado touched down from Tuesdays storms",
    "text": "National Weather Service confirms 4th tornado touched down from Tuesdays storms ST. JOSEPH COUNTY, Mich. (WILX) - The National Weather Service (NWS) has confirmed that a 4th tornado touched down in Michigan during Tuesday, May 7, storms. The NWS says an EF2 tornado touched down around 5:40 p.m. in St. Joseph Co, on the south side of Centreville and traveled northeast passing north of Colon, crossing into Branch Co, near Goodrich Lake, causing extensive to trees and homes including loss of roofs, and walls. The tornado traveled close to 20 miles and had estimated winds up to 130 mph and was about 950 yards in length. There were no fatalities reported however there was one injury. On Wednesday, May 8, Gov Gretchen Whitmer called for a [State of Emergency](https://www.wilx.com/2024/05/08/severe-storms-leave-behind-significant-damage-southwest-michigan-governor-whitmer-declares-state-emergency/) for all counties that were effected with significant damage in Southwest Michigan. Subscribe to our [News 10 newsletter](https://www.wilx.com/newsletter/) and [YouTube page](https://www.youtube.com/@wilxtv) to receive the latest local news and weather. Looking to hire people, or grow your business through advertising? Gray Digital Media is your one-stop marketing solution. [Learn](https://wilx.graydigitalmedia.com/) more. Copyright 2024 WILX. All rights reserved.",
    "highlightText": "",
    "highlightTitle": "",
    "highlightThreadTitle": "",
    "language": "english",
    "sentiment": "negative",
    "categories": [
        "Weather"
    ],
    "webz_reporter": false,
    "external_links": [
        "https://wilx.graydigitalmedia.com/)",
        "https://www.youtube.com/@wilxtv)",
        "https://youtube.com/@wilxtv)",
        "https://www.wilx.graydigitalmedia.com/)"
    ],
    "external_images": [],
    "entities": {
        "persons": [
            {
                "name": "gretchen whitmer",
                "sentiment": "none"
            }
        ],
        "organizations": [
            {
                "name": "national weather service",
                "sentiment": "negative"
            },
            {
                "name": "st. joseph co",
                "sentiment": "none"
            },
            {
                "name": "branch co",
                "sentiment": "none"
            },
            {
                "name": "nws",
                "sentiment": "none"
            }
        ],
        "locations": [
            {
                "name": "centreville",
                "sentiment": "none"
            },
            {
                "name": "goodrich lake",
                "sentiment": "none"
            },
            {
                "name": "southwest michigan",
                "sentiment": "none"
            },
            {
                "name": "michigan",
                "sentiment": "none"
            }
        ]
    },
    "rating": null,
    "crawled": "2024-05-10T01:44:20.929+03:00",
    "updated": "2024-05-10T01:44:20.929+03:00"
}