{
    "thread": {
        "uuid": "27cb476b65177eb6e2f849e4db5e4fb8dd1a2fbc",
        "url": "https://vnexplorer.net/pagasa-danger-level-heat-index-in-27-areas-on-may-11-s2710200.html",
        "site_full": "vnexplorer.net",
        "site": "vnexplorer.net",
        "site_section": "https://vnexplorer.net/latest",
        "site_categories": [
            "health",
            "cold_and_flu"
        ],
        "section_title": "Latest breaking 24h news around the world - VNExplorer",
        "title": "PAGASA: Danger level heat index in 27 areas on May 11",
        "title_full": "PAGASA: Danger level heat index in 27 areas on May 11",
        "published": "2024-05-10T03:00:00.000+03:00",
        "replies_count": 0,
        "participants_count": 1,
        "site_type": "news",
        "country": "VN",
        "main_image": "https://img-s-msn-com.akamaized.net/tenant/amp/entityid/BB1mabZT.img",
        "performance_score": 0,
        "domain_rank": 66565,
        "domain_rank_updated": "2024-05-07T13:07:52.000+03:00",
        "reach": null,
        "social": {
            "facebook": {
                "likes": 0,
                "comments": 0,
                "shares": 0
            },
            "gplus": {
                "shares": 0
            },
            "pinterest": {
                "shares": 0
            },
            "linkedin": {
                "shares": 0
            },
            "stumbledupon": {
                "shares": 0
            },
            "vk": {
                "shares": 0
            }
        }
    },
    "uuid": "27cb476b65177eb6e2f849e4db5e4fb8dd1a2fbc",
    "url": "https://vnexplorer.net/pagasa-danger-level-heat-index-in-27-areas-on-may-11-s2710200.html",
    "ord_in_thread": 0,
    "parent_url": null,
    "author": "VNExplorer",
    "published": "2024-05-10T03:00:00.000+03:00",
    "title": "PAGASA: Danger level heat index in 27 areas on May 11",
    "text": "Vacationers enjoy swimming in the cold waters of Misibis Bay in Cagraray, Bacacay, Albay in the Bicol Region on Saturday, May 4, 2024. According to PAGASA, the province may expect a heat index of 40 to 41 degrees Celsius, classified as under ‘Extreme Caution’, this weekend. DANNY PATA State weather bureau PAGASA said 27 areas would have a heat index in the danger level on Saturday. According to PAGASA’s heat index forecast as of 5 p.m. Friday, the following areas will have heat indexes between 42°C and 46°C. 42°C: NAIA, Pasay City Sinait, Ilocos Sur MMSU, Batac, Ilocos Norte Iba, Zambales Cubi Point, Subic Bay, Olongapo City Sangley Point, Cavite Legazpi City, Albay Cuyo, Palawan Masbate City, Masbate Iloilo City, Iloilo Catbalogan, Samar Tacloban City, Leyte Zamboanga City, Zamboanga del Sur Davao City, Davao del Sur 43°C: Tuguegarao City, Cagayan ISU Echague, Isabela San Jose, Occidental Mindoro CBSUA-Pili, Camarines Sur Dumangas, Iloilo Catarman, Northern Samar Guiuan, Eastern Samar 44°C: Laoag City, Ilocos Norte Aparri, Cagayan Puerto Princesa City, Palawan Roxas City, Capiz 45°C: Dagupan City, Pangasinan 46°C: Virac (Synop), Catanduanes Baguio City and Benguet State University, La Trinidad, Benguet will continue to have the lowest heat index at 26°C. According to PAGASA, areas with a heat index of 42°C to 51°C fall within the danger level. Individuals exposed to heat in said areas are in danger of heat cramps, heat exhaustion, and heat stroke. PAGASA advised the public to limit outdoor activity, remain hydrated, and wear fresh clothes to avoid heat-related illnesses. — Jiselle Anne Casucian/VBL, GMA Integrated News This article was originally published in GMA News Online.News Related - Recall Just Announced For Popular Cookies Featured In Holiday Gift Baskets Anyone who’s purchased gift baskets to hand out to loved ones this holiday season might need to find a backup present after the latest food recall that involves festive cookies. Gift basket company Wine Country Gift Baskets just announced that it is voluntarily recalling all gift baskets that feature Acorn Baking ... See Details: Recall Just Announced For Popular Cookies Featured In Holiday Gift Baskets - Eagles rally past Bills in overtime as Chiefs win LOS ANGELES: Quarterback Jalen Hurts ran in an overtime touchdown to give the Philadelphia Eagles a 37-34 NFL win over the Buffalo Bills Sunday (Monday in Manila) and move them to 10-1 on the season. The Eagles, who lost the Super Bowl to Kansas City last season, trailed at half-time ... See Details: Eagles rally past Bills in overtime as Chiefs win - Reality bites the green energy agenda Yen Makabenta First word WHILE UN Secretary-General Antonio Guterres and other promoters of the climate emergency are preparing to convene the 28th conference of the parties (COP28) of the UN Framework Convention on Climate Change (UNFCCC) in the United Arab Emirates, starting on November 30 and stretching to December 12, ... See Details: Reality bites the green energy agenda - Sandigan orders Marcos Sr. pal to pay workers Sandigan orders Marcos Sr. pal to pay workers The Sandiganbayan has ordered the enforcement of a July 2023 ruling ordering a Marcos Sr. associate to pay a lumber company’s workers P2.1 million in damages as well as return 60 percent of their company’s shares and pay all unpaid benefits. The ... See Details: Sandigan orders Marcos Sr. pal to pay workers - DSWD: Shear line, LPA affect 1.2 million people; over 18,000 families evacuated DSWD: Shear line, LPA affect 1.2 million people; over 18,000 families evacuated MANILA, Philippines – More than 18,000 families have fled to evacuation centers across flood-affected regions in the country due to the impact of the shear line and low pressure area. Department of Social Welfare and Development (DSWD) gave ... See Details: DSWD: Shear line, LPA affect 1.2 million people; over 18,000 families evacuated - The mayor of Paris is making a loud exit from X, calling the platform a 'gigantic global sewer' Paris mayor Anne Hidalgo and X owner and chief technology officer Elon Musk Chesnot and Kirsty Wigglesworth – WPA Pool via Getty Images Paris Mayor Anne Hidalgo says she’s leaving X after 14 years on the platform. In a lengthy farewell post, she said the platform has become a “gigantic global ... See Details: The mayor of Paris is making a loud exit from X, calling the platform a 'gigantic global sewer' - Rain showers, thunderstorms over Luzon, including Metro Manila — Pagasa MANILA, Philippines: The entire Luzon, including Metro Manila, is expected to experience isolated rain showers and thunderstorms as the northeast monsoon (“amihan”) and easterlies will be affecting the country over the next 24 hours, the state-run weather agency said on Tuesday. Weather specialist Patrick del Mundo of the Philippine Atmospheric ... See Details: Rain showers, thunderstorms over Luzon, including Metro Manila — Pagasa - 'Naruto' live-action film adaptation is in the works Attention, Naruto fans! You can soon watch the famous anime’s live-action adaptation as it finally has a confirmed writer. According to a Variety report, the beloved manga and anime series is set to head to big screens for its live-action adaptation under Lionsgate. It will be written by Tasha Hao, ... See Details: 'Naruto' live-action film adaptation is in the works - NASA Highlights Stingray Nebula Attention, Naruto fans! You can soon watch the famous anime’s live-action adaptation as it finally has a confirmed writer. According to a Variety report, the beloved manga and anime series is set to head to big screens for its live-action adaptation under Lionsgate. It will be written by Tasha Hao, ... See Details: NASA Highlights Stingray Nebula - Manila's Lagusnilad underpass opens Attention, Naruto fans! You can soon watch the famous anime’s live-action adaptation as it finally has a confirmed writer. According to a Variety report, the beloved manga and anime series is set to head to big screens for its live-action adaptation under Lionsgate. It will be written by Tasha Hao, ... See Details: Manila's Lagusnilad underpass opens - China probes debt-ridden financial giant Attention, Naruto fans! You can soon watch the famous anime’s live-action adaptation as it finally has a confirmed writer. According to a Variety report, the beloved manga and anime series is set to head to big screens for its live-action adaptation under Lionsgate. It will be written by Tasha Hao, ... See Details: China probes debt-ridden financial giant - China's VUCA situation Attention, Naruto fans! You can soon watch the famous anime’s live-action adaptation as it finally has a confirmed writer. According to a Variety report, the beloved manga and anime series is set to head to big screens for its live-action adaptation under Lionsgate. It will be written by Tasha Hao, ... See Details: China's VUCA situation - Unraveling the mystery that is diabetes Attention, Naruto fans! You can soon watch the famous anime’s live-action adaptation as it finally has a confirmed writer. According to a Variety report, the beloved manga and anime series is set to head to big screens for its live-action adaptation under Lionsgate. It will be written by Tasha Hao, ... See Details: Unraveling the mystery that is diabetes - Bangladesh's nuke plant is not going to steal PH investments Attention, Naruto fans! You can soon watch the famous anime’s live-action adaptation as it finally has a confirmed writer. According to a Variety report, the beloved manga and anime series is set to head to big screens for its live-action adaptation under Lionsgate. It will be written by Tasha Hao, ... See Details: Bangladesh's nuke plant is not going to steal PH investments OTHER NEWS Read more » https://vnexplorer.net/whatsapp-web-gains-the-feature-of-single-view-photos-and-videos-s133683.html https://vnexplorer.net/whatsapp-web-gains-the-feature-of-single-view-photos-and-videos-s133683.html https://vnexplorer.net/young-athletes-time-to-shine-in-siklab-awards-s133682.html https://vnexplorer.net/young-athletes-time-to-shine-in-siklab-awards-s133682.html https://vnexplorer.net/local-exec-says-5-10-barangays-still-isolated-in-northern-samar-s133680.html https://vnexplorer.net/local-exec-says-5-10-barangays-still-isolated-in-northern-samar-s133680.html https://vnexplorer.net/app-made-by-ex-jeepney-driver-will-let-you-pay-puv-fare-book-tricycles-s133679.html https://vnexplorer.net/app-made-by-ex-jeepney-driver-will-let-you-pay-puv-fare-book-tricycles-s133679.html https://vnexplorer.net/updated-in-season-tournament-bracket-ahead-of-pool-play-finale-s133678.html https://vnexplorer.net/updated-in-season-tournament-bracket-ahead-of-pool-play-finale-s133678.html https://vnexplorer.net/pcg-forms-teams-for-maritime-emergency-response-s133677.html https://vnexplorer.net/pcg-forms-teams-for-maritime-emergency-response-s133677.html",
    "highlightText": "",
    "highlightTitle": "",
    "highlightThreadTitle": "",
    "language": "english",
    "sentiment": "negative",
    "categories": [
        "Weather"
    ],
    "webz_reporter": false,
    "external_links": [],
    "external_images": [],
    "entities": {
        "persons": [
            {
                "name": "ilocos norte aparri",
                "sentiment": "none"
            },
            {
                "name": "albay cuyo",
                "sentiment": "none"
            },
            {
                "name": "iloilo catarman",
                "sentiment": "none"
            },
            {
                "name": "samar guiuan",
                "sentiment": "none"
            },
            {
                "name": "subic bay",
                "sentiment": "none"
            }
        ],
        "organizations": [
            {
                "name": "pagasa",
                "sentiment": "negative"
            },
            {
                "name": "eastern samar",
                "sentiment": "none"
            },
            {
                "name": "ilocos norte iba",
                "sentiment": "none"
            },
            {
                "name": "cagayan isu echague",
                "sentiment": "none"
            },
            {
                "name": "occidental mindoro cbsua-pili",
                "sentiment": "none"
            },
            {
                "name": "naia",
                "sentiment": "none"
            }
        ],
        "locations": [
            {
                "name": "cagraray",
                "sentiment": "none"
            },
            {
                "name": "misibis bay",
                "sentiment": "none"
            },
            {
                "name": "albay",
                "sentiment": "none"
            },
            {
                "name": "bacacay",
                "sentiment": "none"
            },
            {
                "name": "pasay city sinait",
                "sentiment": "none"
            },
            {
                "name": "masbate iloilo city",
                "sentiment": "none"
            },
            {
                "name": "zamboanga del sur davao city",
                "sentiment": "none"
            },
            {
                "name": "palawan roxas city",
                "sentiment": "none"
            },
            {
                "name": "iloilo catbalogan",
                "sentiment": "none"
            },
            {
                "name": "leyte zamboanga city",
                "sentiment": "none"
            },
            {
                "name": "davao",
                "sentiment": "none"
            },
            {
                "name": "laoag city",
                "sentiment": "none"
            },
            {
                "name": "zambales cubi point",
                "sentiment": "none"
            },
            {
                "name": "camarines sur dumangas",
                "sentiment": "none"
            },
            {
                "name": "palawan masbate city",
                "sentiment": "none"
            },
            {
                "name": "isabela san jose",
                "sentiment": "none"
            },
            {
                "name": "olongapo city sangley point",
                "sentiment": "none"
            },
            {
                "name": "ilocos sur mmsu",
                "sentiment": "none"
            },
            {
                "name": "tuguegarao city",
                "sentiment": "none"
            },
            {
                "name": "batac",
                "sentiment": "none"
            },
            {
                "name": "samar tacloban city",
                "sentiment": "none"
            },
            {
                "name": "cavite legazpi city",
                "sentiment": "none"
            },
            {
                "name": "capiz",
                "sentiment": "none"
            },
            {
                "name": "cagayan puerto princesa city",
                "sentiment": "none"
            }
        ]
    },
    "rating": null,
    "crawled": "2024-05-10T16:40:54.498+03:00",
    "updated": "2024-05-10T16:40:54.498+03:00"
}