{
    "thread": {
        "uuid": "9019edbec211438ae3a216887c8b5791f51fc791",
        "url": "https://vnexplorer.net/florida-and-georgia-tornado-watch-list-of-counties-cities-under-severe-weather-warning-s2700405.html",
        "site_full": "vnexplorer.net",
        "site": "vnexplorer.net",
        "site_section": "https://vnexplorer.net/latest",
        "site_categories": [
            "health",
            "cold_and_flu"
        ],
        "section_title": "Latest breaking 24h news around the world - VNExplorer",
        "title": "Florida And Georgia Tornado Watch: List Of Counties, Cities Under Severe Weather Warning",
        "title_full": "Florida And Georgia Tornado Watch: List Of Counties, Cities Under Severe Weather Warning",
        "published": "2024-05-09T03:00:00.000+03:00",
        "replies_count": 0,
        "participants_count": 1,
        "site_type": "news",
        "country": "VN",
        "main_image": "https://img-s-msn-com.akamaized.net/tenant/amp/entityid/BB1m7AOL.img",
        "performance_score": 0,
        "domain_rank": 66565,
        "domain_rank_updated": "2024-05-07T13:07:52.000+03:00",
        "reach": null,
        "social": {
            "facebook": {
                "likes": 0,
                "comments": 0,
                "shares": 0
            },
            "gplus": {
                "shares": 0
            },
            "pinterest": {
                "shares": 0
            },
            "linkedin": {
                "shares": 0
            },
            "stumbledupon": {
                "shares": 0
            },
            "vk": {
                "shares": 0
            }
        }
    },
    "uuid": "9019edbec211438ae3a216887c8b5791f51fc791",
    "url": "https://vnexplorer.net/florida-and-georgia-tornado-watch-list-of-counties-cities-under-severe-weather-warning-s2700405.html",
    "ord_in_thread": 0,
    "parent_url": null,
    "author": "VNExplorer",
    "published": "2024-05-09T03:00:00.000+03:00",
    "title": "Florida And Georgia Tornado Watch: List Of Counties, Cities Under Severe Weather Warning",
    "text": "florida and georgia tornado watch list of counties cities under severe weather warning Several cities and counties in Florida and Georgia are under tornado watch till 9 p.m. EDT Thursday. The following counties and cities are under watch – Florida Counties – Duval Nassau Georgia Counties – Brantley Camden Charlton Clinch Echols Glynn Pierce Ware Wayne Cities in Florida and Georgia – Amelia City, Arlington, Atkinson, Blackshear, Country Club Estate, Dock Junction, Doctortown, Dover Bluff, Dungeness, Fernandina Beach, Folkston, Gardi, Glynn Haven, Hickox, Hilliard, Hoboken, Homeland, Homerville, Hortense, Jacksonville, Jekyll Island, Jesup, Kings Ferry, Kingsland, Nahunta, Needham, Needmore, Normandy, Oceanway, Ortega, Race Pond, Ratliff, Raybon, Riverside, San Marco, Sea Island, St. George, St. Simons, Statenville, Stephen Foster State Park, Thalmann, Waycross, Waynesville, Winokur, and YuleeNews Related - Anurag Kashyap unveils teaser of ‘Kastoori’ Anurag Kashyap unveils teaser of ‘Kastoori’ Finally, the highly anticipated teaser of the National Award-winning film ‘Kastoori’ launched, offering a glimpse into the compelling tale of childhood in search of the smell of happiness. Directed by Vinod Kamble and presented by acclaimed filmmakers Anurag Kashyap and Nagraj Popatrao Manjule, delves ... See Details: Anurag Kashyap unveils teaser of ‘Kastoori’ - Shehar Lakhot: Meet The Intriguing Characters Of The Upcoming Noir Crime Drama New Delhi: After the overwhelming response to the action-packed trailer of the noir crime drama, ‘Shehar Lakhot’, Prime Video has unveiled intriguing posters featuring the intriguing leads of the series, raising the excitement among the audiences and capturing their attention. The eight-episode drama features interesting and multi-layered characters played by ... See Details: Shehar Lakhot: Meet The Intriguing Characters Of The Upcoming Noir Crime Drama - Watch: 'My name is VVS Laxman...': When Ishan Kishan gave wrong answers to right questions Watch: ‘My name is VVS Laxman…’: When Ishan Kishan gave wrong answers to right questions NEW DELHI: With a comfortable 2-0 series lead against Australia in the five-match series, Indian cricketers are chilling it out, having fun, enjoying each others’ company. After Monday’s video of Axar Patel throwing a ‘challenge’ ... See Details: Watch: 'My name is VVS Laxman...': When Ishan Kishan gave wrong answers to right questions - Tennis-Sabalenka, Rybakina to open new season in Brisbane FILE PHOTO: Tennis – WTA Finals – Cancun, Mexico – November 5, 2023 Belarus’ Aryna Sabalenka in action during her semi final match against Poland’s Iga Swiatek REUTERS/Henry Romero SYDNEY (Reuters) – World number two Aryna Sabalenka and number four Elena Rybakina will open their 2024 seasons at the Brisbane ... See Details: Tennis-Sabalenka, Rybakina to open new season in Brisbane - Sikandar Raza Makes History For Zimbabwe With Hattrick A Day After Punjab Kings Retain Him- WATCH sikandar raza makes history for zimbabwe with hattrick a day after punjab kings retain him- watch Zimbabwe allrounder Sikandar Raza created history on Monday by becoming the first male cricketer from his country to pick a hat trick in T20Is. He achieved the feat in Zimbabwe’s game against Rwanda in ... See Details: Sikandar Raza Makes History For Zimbabwe With Hattrick A Day After Punjab Kings Retain Him- WATCH - Delayed Barapullah work yet to begin despite land transfer A view of the under-construction Barapullah flyover near Mayur Vihar on Monday. Work on the third and last phase of the much-delayed Barapullah flyover project will be completed in one year, officials in the Public Works Department said, a week after the lieutenant governor (LG) approved the land transfer for ... See Details: Delayed Barapullah work yet to begin despite land transfer - Army called in to help in tunnel rescue operation Army called in to help in tunnel rescue operation Vertical drilling also starts as part of ‘Plan B’SILKYARA: Personnel from Madras Sappers regiment of the Army’s Corps of Engineers were pressed into service on Sunday to clear the escape passage in the Silkyara tunnel where blades of the auger drilling ... See Details: Army called in to help in tunnel rescue operation - FIR against Redbird aviation school for non-cooperation, obstructing DGCA officials in probe On October 19, the training institute’s Tecnam P2008JC (single engine) aircraft VT-RBC took off from runway 11 at Baramati with sole occupant on board. The Baramati Taluka Police have lodged a first information report (FIR) against flying training school Redbird Flight Training Academy on Monday, officials said. The Directorate General ... See Details: FIR against Redbird aviation school for non-cooperation, obstructing DGCA officials in probe - IPL 2024 Auction: Why Gujarat Titans allowed Hardik Pandya to join Mumbai Indians? GT explain On October 19, the training institute’s Tecnam P2008JC (single engine) aircraft VT-RBC took off from runway 11 at Baramati with sole occupant on board. The Baramati Taluka Police have lodged a first information report (FIR) against flying training school Redbird Flight Training Academy on Monday, officials said. The Directorate General ... See Details: IPL 2024 Auction: Why Gujarat Titans allowed Hardik Pandya to join Mumbai Indians? GT explain - From puff sleeves to sustainable designs: Top 5 bridal fashion trends redefining elegance and style for brides-to-be On October 19, the training institute’s Tecnam P2008JC (single engine) aircraft VT-RBC took off from runway 11 at Baramati with sole occupant on board. The Baramati Taluka Police have lodged a first information report (FIR) against flying training school Redbird Flight Training Academy on Monday, officials said. The Directorate General ... See Details: From puff sleeves to sustainable designs: Top 5 bridal fashion trends redefining elegance and style for brides-to-be - The Judge behind China's financial reckoning On October 19, the training institute’s Tecnam P2008JC (single engine) aircraft VT-RBC took off from runway 11 at Baramati with sole occupant on board. The Baramati Taluka Police have lodged a first information report (FIR) against flying training school Redbird Flight Training Academy on Monday, officials said. The Directorate General ... See Details: The Judge behind China's financial reckoning - Arshdeep Singh & Axar Patel Out, Avesh Khan & Washington Sundar IN? India's Likely Playing XI For 3rd T20I On October 19, the training institute’s Tecnam P2008JC (single engine) aircraft VT-RBC took off from runway 11 at Baramati with sole occupant on board. The Baramati Taluka Police have lodged a first information report (FIR) against flying training school Redbird Flight Training Academy on Monday, officials said. The Directorate General ... See Details: Arshdeep Singh & Axar Patel Out, Avesh Khan & Washington Sundar IN? India's Likely Playing XI For 3rd T20I - Horoscope Today, November 28, 2023: Check here Astrological prediction for all zodiac signs On October 19, the training institute’s Tecnam P2008JC (single engine) aircraft VT-RBC took off from runway 11 at Baramati with sole occupant on board. The Baramati Taluka Police have lodged a first information report (FIR) against flying training school Redbird Flight Training Academy on Monday, officials said. The Directorate General ... See Details: Horoscope Today, November 28, 2023: Check here Astrological prediction for all zodiac signs - 'Gurdwaras are...': US Sikh body on Indian envoy's heckling by Khalistani backers On October 19, the training institute’s Tecnam P2008JC (single engine) aircraft VT-RBC took off from runway 11 at Baramati with sole occupant on board. The Baramati Taluka Police have lodged a first information report (FIR) against flying training school Redbird Flight Training Academy on Monday, officials said. The Directorate General ... See Details: 'Gurdwaras are...': US Sikh body on Indian envoy's heckling by Khalistani backers OTHER NEWS Read more » https://vnexplorer.net/what-us-easing-sanctions-on-venezuela-home-to-worlds-largest-oil-reserves-could-mean-for-india-s135124.html https://vnexplorer.net/what-us-easing-sanctions-on-venezuela-home-to-worlds-largest-oil-reserves-could-mean-for-india-s135124.html https://vnexplorer.net/rajshri-deshpande-dedicates-ott-award-to-innocent-lives-lost-in-gaza-palestine-s135122.html https://vnexplorer.net/rajshri-deshpande-dedicates-ott-award-to-innocent-lives-lost-in-gaza-palestine-s135122.html https://vnexplorer.net/ramchandra-keh-gaye-from-jan-1-rss-to-spread-word-of-god-ayodhya-inauguration-among-10-crore-people-s135118.html ‘Ramchandra Keh Gaye…’: From Jan 1, RSS to Spread Word of God, Ayodhya Inauguration Among 10 Crore People https://vnexplorer.net/ramchandra-keh-gaye-from-jan-1-rss-to-spread-word-of-god-ayodhya-inauguration-among-10-crore-people-s135118.html https://vnexplorer.net/ace-designer-rohit-bal-critical-on-ventilator-report-s135114.html https://vnexplorer.net/ace-designer-rohit-bal-critical-on-ventilator-report-s135114.html https://vnexplorer.net/bengaluru-traffic-advisory-issued-parking-restrictions-in-place-as-samyukta-horata-samiti-holds-protest-details-s135111.html Bengaluru: Traffic Advisory Issued, Parking Restrictions In Place As Samyukta Horata Samiti Holds Protest | Details https://vnexplorer.net/bengaluru-traffic-advisory-issued-parking-restrictions-in-place-as-samyukta-horata-samiti-holds-protest-details-s135111.html https://vnexplorer.net/vistara-flights-diverted-due-to-air-congestion-at-delhi-airport-details-s135110.html https://vnexplorer.net/vistara-flights-diverted-due-to-air-congestion-at-delhi-airport-details-s135110.html",
    "highlightText": "",
    "highlightTitle": "",
    "highlightThreadTitle": "",
    "language": "english",
    "sentiment": "negative",
    "categories": [
        "Weather"
    ],
    "webz_reporter": false,
    "external_links": [],
    "external_images": [],
    "entities": {
        "persons": [
            {
                "name": "hickox",
                "sentiment": "none"
            },
            {
                "name": "ortega",
                "sentiment": "none"
            },
            {
                "name": "hortense",
                "sentiment": "none"
            },
            {
                "name": "ratliff",
                "sentiment": "none"
            },
            {
                "name": "winokur",
                "sentiment": "none"
            },
            {
                "name": "hilliard",
                "sentiment": "none"
            },
            {
                "name": "gardi",
                "sentiment": "none"
            },
            {
                "name": "raybon",
                "sentiment": "none"
            },
            {
                "name": "anurag kashyap",
                "sentiment": "none"
            },
            {
                "name": "dover bluff",
                "sentiment": "none"
            },
            {
                "name": "stephen foster",
                "sentiment": "none"
            }
        ],
        "organizations": [
            {
                "name": "jesup",
                "sentiment": "none"
            },
            {
                "name": "atkinson, blackshear, country club estate",
                "sentiment": "none"
            },
            {
                "name": "brantley camden charlton clinch echols glynn pierce ware wayne cities",
                "sentiment": "none"
            }
        ],
        "locations": [
            {
                "name": "georgia",
                "sentiment": "none"
            },
            {
                "name": "florida",
                "sentiment": "none"
            },
            {
                "name": "thalmann",
                "sentiment": "none"
            },
            {
                "name": "sea island",
                "sentiment": "none"
            },
            {
                "name": "st. george",
                "sentiment": "none"
            },
            {
                "name": "statenville",
                "sentiment": "none"
            },
            {
                "name": "kingsland",
                "sentiment": "none"
            },
            {
                "name": "homerville",
                "sentiment": "none"
            },
            {
                "name": "jacksonville",
                "sentiment": "none"
            },
            {
                "name": "arlington",
                "sentiment": "none"
            },
            {
                "name": "state park",
                "sentiment": "none"
            },
            {
                "name": "duval nassau georgia",
                "sentiment": "none"
            },
            {
                "name": "folkston",
                "sentiment": "none"
            },
            {
                "name": "hoboken",
                "sentiment": "none"
            },
            {
                "name": "needham",
                "sentiment": "none"
            },
            {
                "name": "fernandina beach",
                "sentiment": "none"
            },
            {
                "name": "nahunta",
                "sentiment": "none"
            },
            {
                "name": "glynn haven",
                "sentiment": "none"
            },
            {
                "name": "amelia city",
                "sentiment": "none"
            },
            {
                "name": "waynesville",
                "sentiment": "none"
            },
            {
                "name": "doctortown",
                "sentiment": "none"
            },
            {
                "name": "jekyll island",
                "sentiment": "none"
            },
            {
                "name": "waycross",
                "sentiment": "none"
            },
            {
                "name": "oceanway",
                "sentiment": "none"
            },
            {
                "name": "normandy",
                "sentiment": "none"
            },
            {
                "name": "st. simons",
                "sentiment": "none"
            },
            {
                "name": "riverside",
                "sentiment": "none"
            },
            {
                "name": "san marco",
                "sentiment": "none"
            }
        ]
    },
    "rating": null,
    "crawled": "2024-05-10T01:38:01.263+03:00",
    "updated": "2024-05-10T01:38:01.263+03:00"
}