{
    "thread": {
        "uuid": "5a0f706a878afb135dce2c9609d04f54d647da0d",
        "url": "https://deadspin.com/orioles-place-2b-jorge-mateo-elbow-on-injured-list",
        "site_full": "deadspin.com",
        "site": "deadspin.com",
        "site_section": "https://deadspin.com/rss",
        "site_categories": [
            "media"
        ],
        "section_title": "Deadspin > Sports News Without Fear, Favor or Compromise",
        "title": "Orioles place 2B Jorge Mateo (elbow) on injured list",
        "title_full": "Orioles place 2B Jorge Mateo (elbow) on injured list",
        "published": "2024-07-25T19:52:00.000+03:00",
        "replies_count": 0,
        "participants_count": 1,
        "site_type": "news",
        "country": "US",
        "main_image": "https://lineup-publishing.s3.amazonaws.com/23658168.jpg",
        "performance_score": 0,
        "domain_rank": 4048,
        "domain_rank_updated": "2024-07-23T13:08:24.000+03:00",
        "reach": null,
        "social": {
            "facebook": {
                "likes": 0,
                "comments": 0,
                "shares": 0
            },
            "gplus": {
                "shares": 0
            },
            "pinterest": {
                "shares": 0
            },
            "linkedin": {
                "shares": 0
            },
            "stumbledupon": {
                "shares": 0
            },
            "vk": {
                "shares": 0
            }
        }
    },
    "uuid": "5a0f706a878afb135dce2c9609d04f54d647da0d",
    "url": "https://deadspin.com/orioles-place-2b-jorge-mateo-elbow-on-injured-list",
    "ord_in_thread": 0,
    "parent_url": null,
    "author": "Field Level Media",
    "published": "2024-07-25T19:52:00.000+03:00",
    "title": "Orioles place 2B Jorge Mateo (elbow) on injured list",
    "text": "Orioles place 2B Jorge Mateo (elbow) on injured list\n[Field Level Media](/author/fieldlevelmedia/)|published: Thu Jul 25 2024 16:52\nJun 30, 2024; Baltimore, Maryland, USA; Baltimore Orioles second base Jorge Mateo (3) reacts after a strike out during the fifth inning against the Texas Rangers at Oriole Park at Camden Yards. Mandatory Credit: Reggie Hildred-USA TODAY Sports\nThe Baltimore Orioles placed second baseman Jorge Mateo on the 10-day injured list Thursday due to a dislocated left elbow.\nThe injury occurred during Tuesday's 6-3 loss at Miami when Mateo collided with shortstop Gunnar Henderson as both players pursued a third-inning ground ball by Marlins outfielder Jesus Sanchez.\nMateo, 29, is batting .229 with five homers, 18 RBIs and 13 stolen bases in 68 games this season. He has started 52 games at second base, three at shortstop and two in center field.\nThe Orioles also recalled infielder/outfielder Connor Norby and right-hander Bryan Baker from Triple-A Norfolk and optioned right-hander Chayce McDermott to Norfolk.\n--Field Level Media",
    "highlightText": "",
    "highlightTitle": "",
    "highlightThreadTitle": "",
    "language": "english",
    "sentiment": "negative",
    "categories": [
        "Sport"
    ],
    "webz_reporter": false,
    "external_links": [],
    "external_images": [],
    "entities": {
        "persons": [
            {
                "name": "jorge mateo",
                "sentiment": "negative"
            },
            {
                "name": "mateo",
                "sentiment": "none"
            },
            {
                "name": "bryan baker",
                "sentiment": "none"
            },
            {
                "name": "gunnar henderson",
                "sentiment": "none"
            },
            {
                "name": "connor norby",
                "sentiment": "none"
            },
            {
                "name": "reggie hildred",
                "sentiment": "none"
            },
            {
                "name": "chayce mcdermott",
                "sentiment": "none"
            },
            {
                "name": "jesus sanchez",
                "sentiment": "none"
            }
        ],
        "organizations": [
            {
                "name": "orioles",
                "sentiment": "negative"
            },
            {
                "name": "texas rangers",
                "sentiment": "none"
            },
            {
                "name": "baltimore orioles",
                "sentiment": "none"
            },
            {
                "name": "marlins",
                "sentiment": "none"
            }
        ],
        "locations": [
            {
                "name": "mateo",
                "sentiment": "none"
            },
            {
                "name": "usa",
                "sentiment": "none"
            },
            {
                "name": "baltimore",
                "sentiment": "none"
            },
            {
                "name": "oriole park",
                "sentiment": "none"
            },
            {
                "name": "maryland",
                "sentiment": "none"
            },
            {
                "name": "camden yards",
                "sentiment": "none"
            },
            {
                "name": "norfolk",
                "sentiment": "none"
            },
            {
                "name": "miami",
                "sentiment": "none"
            }
        ]
    },
    "rating": null,
    "crawled": "2024-07-26T00:01:26.001+03:00",
    "updated": "2024-07-26T00:01:26.001+03:00"
}