{
    "thread": {
        "uuid": "28568c40f674bad71c8c193aa7a7f457635d83e0",
        "url": "https://thetandd.com/sports/professional/nfl/nfl-preseason-arizona-cardinals-at-minnesota-vikings/image_b64f4652-6977-522a-9f19-5a52e0637db1.html",
        "site_full": "thetandd.com",
        "site": "thetandd.com",
        "site_section": "https://thetandd.com/search/?f=rss&amp",
        "site_categories": [
            "media"
        ],
        "section_title": "thetandd.com - RSS Results",
        "title": "NFL: Preseason-Arizona Cardinals at Minnesota Vikings",
        "title_full": "NFL: Preseason-Arizona Cardinals at Minnesota Vikings",
        "published": "2023-12-28T21:16:00.000+02:00",
        "replies_count": 0,
        "participants_count": 1,
        "site_type": "news",
        "country": "US",
        "main_image": "https://bloximages.chicago2.vip.townnews.com/thetandd.com/content/tncms/assets/v3/editorial/b/64/b64f4652-6977-522a-9f19-5a52e0637db1/658dcf25f368d.image.jpg?crop=1100%2C578%2C0%2C77&amp;resize=1100%2C578&amp;order=crop%2Cresize",
        "performance_score": 0,
        "domain_rank": 27595,
        "domain_rank_updated": "2023-12-26T12:06:20.000+02:00",
        "reach": null,
        "social": {
            "facebook": {
                "likes": 0,
                "comments": 0,
                "shares": 0
            },
            "gplus": {
                "shares": 0
            },
            "pinterest": {
                "shares": 0
            },
            "linkedin": {
                "shares": 0
            },
            "stumbledupon": {
                "shares": 0
            },
            "vk": {
                "shares": 0
            }
        }
    },
    "uuid": "28568c40f674bad71c8c193aa7a7f457635d83e0",
    "url": "https://thetandd.com/sports/professional/nfl/nfl-preseason-arizona-cardinals-at-minnesota-vikings/image_b64f4652-6977-522a-9f19-5a52e0637db1.html",
    "ord_in_thread": 0,
    "parent_url": null,
    "author": "Jeffrey Becker-USA TODAY Sports",
    "published": "2023-12-28T21:16:00.000+02:00",
    "title": "NFL: Preseason-Arizona Cardinals at Minnesota Vikings",
    "text": "NFL: Preseason-Arizona Cardinals at Minnesota Vikings Jeffrey Becker-USA TODAY Sports Dec 28, 2023 Dec 28, 2023 Updated 2 hrs ago 0 Facebook WhatsApp SMS Print Copy article link Save Aug 26, 2023; Minneapolis, Minnesota, USA; Minnesota Vikings quarterback Jaren Hall (16) throws a pass against the Arizona Cardinals during the third quarter at U.S. Bank Stadium. Mandatory Credit: Jeffrey Becker-USA TODAY Sports Jeffrey Becker-USA TODAY Sports Tags Dcc Wire Fieldlevelmedia Tncen Football Nfl News Top Story Jaren Hall Vikings As featured on Vikings to start rookie QB Jaren Hall against Packers Vikings to start rookie QB Jaren Hall against Packers Facebook WhatsApp SMS Print Copy article link Save Most Popular Fire destroys Lone Star BBQ in Santee UPDATED: ‘Everything’s gone’: Lone Star Barbecue in Santee burns ‘Bundle of joy’ among crash victims; mother, fiancé, 3-year-old died in collision Homes planned for U.S. 301 property 3-year-old among those killed in Orangeburg County crash Promotions Download our mobile app for a customized experience! Get the most important news in your inbox as it happens. Sign up for Breaking News: View All Print Ads Service DOWNTOWN ORBG. RE. ASSOC. - Ad from 2023-12-23 Dec 23, 2023",
    "highlightText": "",
    "highlightTitle": "",
    "highlightThreadTitle": "",
    "language": "english",
    "sentiment": "negative",
    "categories": [
        "Sport",
        "War, Conflict and Unrest"
    ],
    "external_links": [],
    "external_images": [],
    "entities": {
        "persons": [
            {
                "name": "jeffrey becker",
                "sentiment": "negative"
            },
            {
                "name": "jaren hall",
                "sentiment": "none"
            }
        ],
        "organizations": [
            {
                "name": "nfl",
                "sentiment": "negative"
            },
            {
                "name": "minnesota vikings",
                "sentiment": "negative"
            },
            {
                "name": "minnesota vikings nfl",
                "sentiment": "negative"
            },
            {
                "name": "arizona cardinals",
                "sentiment": "negative"
            },
            {
                "name": "packers vikings",
                "sentiment": "none"
            },
            {
                "name": "dcc wire fieldlevelmedia tncen football nfl news top story jaren hall vikings",
                "sentiment": "none"
            },
            {
                "name": "facebook",
                "sentiment": "none"
            },
            {
                "name": "u.s. bank stadium",
                "sentiment": "none"
            },
            {
                "name": "packers facebook",
                "sentiment": "none"
            }
        ],
        "locations": [
            {
                "name": "usa",
                "sentiment": "none"
            },
            {
                "name": "lone star bbq",
                "sentiment": "none"
            },
            {
                "name": "u.s.",
                "sentiment": "none"
            },
            {
                "name": "minneapolis",
                "sentiment": "none"
            },
            {
                "name": "santee",
                "sentiment": "none"
            },
            {
                "name": "orangeburg county",
                "sentiment": "none"
            },
            {
                "name": "minnesota",
                "sentiment": "none"
            }
        ]
    },
    "rating": null,
    "crawled": "2023-12-29T00:24:11.345+02:00",
    "updated": "2023-12-29T00:24:11.345+02:00"
}