{
    "thread": {
        "uuid": "b08a03f13fb987d98f44e43d2757febfddfa5731",
        "url": "https://www.espn.com.au/football/report/_/gameId/671211",
        "site_full": "www.espn.com.au",
        "site": "espn.com.au",
        "site_section": "https://www.espn.com.au/rss",
        "site_categories": [
            "sports"
        ],
        "section_title": "",
        "title": "Late rally stalls out as Brighton thrash Tottenham",
        "title_full": "Late rally stalls out as Brighton thrash Tottenham",
        "published": "2023-12-29T04:29:17.000+02:00",
        "replies_count": 0,
        "participants_count": 1,
        "site_type": "news",
        "country": "AU",
        "main_image": "https://a.espncdn.com/combiner/i?img=/i/espn/misc_logos/500/soccer.png",
        "performance_score": 0,
        "domain_rank": 20482,
        "domain_rank_updated": "2023-12-26T12:06:20.000+02:00",
        "reach": null,
        "social": {
            "facebook": {
                "likes": 0,
                "comments": 0,
                "shares": 0
            },
            "gplus": {
                "shares": 0
            },
            "pinterest": {
                "shares": 0
            },
            "linkedin": {
                "shares": 0
            },
            "stumbledupon": {
                "shares": 0
            },
            "vk": {
                "shares": 0
            }
        }
    },
    "uuid": "b08a03f13fb987d98f44e43d2757febfddfa5731",
    "url": "https://www.espn.com.au/football/report/_/gameId/671211",
    "ord_in_thread": 0,
    "parent_url": null,
    "author": "Reuters Updated Dec",
    "published": "2023-12-29T04:29:17.000+02:00",
    "title": "Late rally stalls out as Brighton thrash Tottenham",
    "text": "- Jack Hinshelwood (11')\n- João Pedro (23' Pen, 75' Pen)\n- Pervis Estupiñán (63')\n- Alejo Veliz (81')\n- Ben Davies (85')\nTottenham fall to Brighton as late rally comes up short\nTottenham Hotspur's top-four ambitions suffered a blow as they lost 4-2 at Brighton & Hove Albion in the Premier League on Thursday with only a late rally saving them from their heaviest defeat since Ange Postecoglou became manager.\nVictory would have put injury-hit Spurs above\nManchester City into fourth spot but they were mauled on the south coast as a Brighton side also missing key players ran riot.\n-\nStream on ESPN+: LaLiga, Bundesliga, more (U.S.)\nA powerful early strike by Josh Hinshelwood and Joao\nPedro's penalty gave the hosts a deserved 2-0 lead at half-time as Tottenham struggled to deal with Brighton's intensity.\nThe visitors responded in the second half with\nRicharlison having a goal disallowed but when halftime substitute Pervis Estupinan sent a thunderbolt past Spurs keeper Guglielmo Vicario and Joao Pedro netted a second penalty the game seemed over.\nHowever, when Tottenham's late substitute\nAlejo Veliz fired home from close range in the 75th minute and Ben Davies scored with a header a miraculous comeback suddenly looked possible.\nMidfielder Pierre-Emile Hojbjerg hit the post for Spurs in stoppage time as Brighton looked nervy, but they held on to move into eighth place in the table on 30 points while Tottenham remain fifth on 36, a point off the top four.\nThe final scoreline hardly did justice to a chaotic match in which Tottenham were off the pace for long periods but showed admirable spirit to emerge with their pride intact.\nFor Brighton, without the likes of winger Kaoru Mitoma, Tariq Lamptey, Solly March and Julio Enciso, they snapped a three-match winless sequence.\nTottenham's defensive problems, made worse by centre-back Cristian Romero having been added to their injury list, were exposed by Brighton as the hosts dominated the first half.\nVicario had already made two saves before Hinshelwood was played in by Joao Pedro on the edge of the area and thumped an unstoppable shot high into the net.\nBrighton almost doubled their lead when Jan Paul van Hecke's header hit the post and as the ball rebounded towards Danny Welbeck the striker was pulled back by Dejan Kulusevski with a penalty being awarded after a VAR check.\nJoao Pedro rolled the 23rd-minute spot kick past Vicario to put Brighton in command, although Richarlison nearly responded just before half-time with a shot that kissed the post.\nSpurs looked brighter after the break and wasted several chances before Richarlison netted, only to have his joy cut short as VAR showed he was offside.\nEstupinan made it 3-0 to Brighton with a sensational strike from outside the area before Tottenham substitute Giovani Lo Celso conceded a penalty that was dispatched by Joao Pedro.\nA raft of substitutions revived Spurs with Bryan Gil and Veliz adding some energy to the visitors and the latter celebrated wildly as he slotted his first goal for the club.\nDavies headed in from close range and Tottenham then had numerous chances to try to grab an unlikely point.\nGame Information\n- Referees:\n- Jarred Gillett\nEnglish Premier League Standings\n|Team\n|GP\n|W\n|D\n|L\n|GD\n|P\nArsenal Aston Villa https://www.espn.com.au/football/club/_/id/382/manchester-city https://www.espn.com.au/football/club/_/id/367/tottenham-hotspur West Ham United Manchester United Brighton & Hove Albion Newcastle United Chelsea Wolverhampton Wanderers AFC Bournemouth Fulham Brentford Crystal Palace Nottingham Forest Everton Luton Town Burnley Sheffield United\nPremier League News\nBritish members of parliament are calling for the creation of a new criminal offence of unlawfully entering a soccer match, plus better collaboration between United Kingdom and overseas police to improve safety at sports event at home and abroad.\nUK lawmakers call for punishment for unlawfully entering matches\nBrighton & Hove Albion picked up a big 4-2 home win over Tottenham Hotspur ending their four game losing streak in the process.",
    "highlightText": "",
    "highlightTitle": "",
    "highlightThreadTitle": "",
    "language": "english",
    "sentiment": "negative",
    "categories": [
        "Sport"
    ],
    "external_links": [],
    "external_images": [],
    "entities": {
        "persons": [
            {
                "name": "alejo veliz",
                "sentiment": "negative"
            },
            {
                "name": "joão pedro",
                "sentiment": "negative"
            },
            {
                "name": "pervis estupiñán",
                "sentiment": "negative"
            },
            {
                "name": "jack hinshelwood",
                "sentiment": "negative"
            },
            {
                "name": "joao pedro",
                "sentiment": "none"
            },
            {
                "name": "richarlison",
                "sentiment": "none"
            },
            {
                "name": "pervis estupinan",
                "sentiment": "none"
            },
            {
                "name": "josh hinshelwood",
                "sentiment": "none"
            },
            {
                "name": "ben davies",
                "sentiment": "none"
            },
            {
                "name": "ange postecoglou",
                "sentiment": "none"
            },
            {
                "name": "guglielmo vicario",
                "sentiment": "none"
            }
        ],
        "organizations": [
            {
                "name": "tottenham",
                "sentiment": "negative"
            },
            {
                "name": "tottenham hotspur",
                "sentiment": "none"
            },
            {
                "name": "brighton & hove albion",
                "sentiment": "none"
            },
            {
                "name": "premier league",
                "sentiment": "none"
            },
            {
                "name": "espn",
                "sentiment": "none"
            },
            {
                "name": "spurs",
                "sentiment": "none"
            }
        ],
        "locations": [
            {
                "name": "brighton",
                "sentiment": "none"
            },
            {
                "name": "u.s.",
                "sentiment": "none"
            },
            {
                "name": "manchester city",
                "sentiment": "none"
            }
        ]
    },
    "rating": null,
    "crawled": "2023-12-29T04:29:18.168+02:00",
    "updated": "2023-12-29T04:29:18.168+02:00"
}