{
    "thread": {
        "uuid": "3becf65a154778962d6ba8399f8998ac26ee6cf6",
        "url": "https://www.bernama.com/en/news.php?id=2281910",
        "site_full": "www.bernama.com",
        "site": "bernama.com",
        "site_section": "http://www.bernama.com/en/rssfeed.php",
        "site_categories": [
            "social"
        ],
        "section_title": "BERNAMA - English Version",
        "title": "General : Heatwave Hits Perlis For Two Consecutive Days",
        "title_full": "General : Heatwave Hits Perlis For Two Consecutive Days",
        "published": "2024-03-22T16:29:00.000+02:00",
        "replies_count": 0,
        "participants_count": 1,
        "site_type": "news",
        "country": "MY",
        "main_image": "https://www.bernama.com/storage/photos/274bab3792fc9fbb6dd09b615bffe45660f976b452a2d-medium",
        "performance_score": 0,
        "domain_rank": 14742,
        "domain_rank_updated": "2024-03-19T12:07:56.000+02:00",
        "reach": null,
        "social": {
            "facebook": {
                "likes": 0,
                "comments": 0,
                "shares": 0
            },
            "gplus": {
                "shares": 0
            },
            "pinterest": {
                "shares": 0
            },
            "linkedin": {
                "shares": 0
            },
            "stumbledupon": {
                "shares": 0
            },
            "vk": {
                "shares": 0
            }
        }
    },
    "uuid": "3becf65a154778962d6ba8399f8998ac26ee6cf6",
    "url": "https://www.bernama.com/en/news.php?id=2281910",
    "ord_in_thread": 0,
    "parent_url": null,
    "author": "BERNAMA",
    "published": "2024-03-22T16:29:00.000+02:00",
    "title": "General : Heatwave Hits Perlis For Two Consecutive Days",
    "text": "KUALA LUMPUR, March 22 (Bernama) -- A Level 2 heatwave hit Perlis today, according to the Malaysian Meteorological Department (MetMalaysia).\nBased on the daily hot weather data shared by the department on Facebook, a Level 2 heatwave occurs when the daily maximum temperature reaches 37 to 40 degrees Celsius for at least three consecutive days.\nMetMalaysia also identified 12 areas in the Peninsula under Level 1 (alert) namely, Langkawi, Pokok Sena, Kubang Pasu, Padang Terap, Sik, Baling, Kuala Muda, Pendang and Kota Setar in Kedah as well as Hulu Perak, Kuala Kangsar and Kinta in Perak.\nLevel 1 refers to the daily maximum temperatures of 35 to 37 degrees Celsius for at least three consecutive days.\nMetMalaysia previously announced that Malaysia is in the final phase of the Northeast Monsoon, which typically sees the northern parts of the Peninsula experiencing fewer clouds and less rainfall, resulting in hotter and drier weather.\nDue to the El Nino phenomenon, which is raising global temperatures, the department also expects daily maximum temperatures in the country to be higher in most places.\n-- BERNAMA\nBERNAMA provides up-to-date authentic and comprehensive news and information which are disseminated via BERNAMA Wires; www.bernama.com; BERNAMA TV on Astro 502, unifi TV 631 and MYTV 121 IFLIX channels and BERNAMA Radio on FM93.9 (Klang Valley), FM107.5 (Johor Bahru), FM107.9 (Kota Kinabalu) and FM100.9 (Kuching) frequencies.\nFollow us on social media :\nFacebook : @bernamaofficial, @bernamatv, @bernamaradio\nTwitter : @bernama.com, @BernamaTV, @bernamaradio\nInstagram : @bernamaofficial, @bernamatvofficial, @bernamaradioofficial\nTikTok : @bernamaofficial",
    "highlightText": "",
    "highlightTitle": "",
    "highlightThreadTitle": "",
    "language": "english",
    "sentiment": "negative",
    "categories": [
        "Weather"
    ],
    "external_links": [],
    "external_images": [],
    "entities": {
        "persons": [
            {
                "name": "perlis",
                "sentiment": "negative"
            },
            {
                "name": "metmalaysia",
                "sentiment": "none"
            },
            {
                "name": "sik",
                "sentiment": "none"
            },
            {
                "name": "kota setar",
                "sentiment": "none"
            },
            {
                "name": "pendang",
                "sentiment": "none"
            },
            {
                "name": "pokok sena",
                "sentiment": "none"
            },
            {
                "name": "kinta",
                "sentiment": "none"
            }
        ],
        "organizations": [
            {
                "name": "el nino",
                "sentiment": "none"
            },
            {
                "name": "meteorological department",
                "sentiment": "none"
            },
            {
                "name": "northeast monsoon",
                "sentiment": "none"
            },
            {
                "name": "facebook",
                "sentiment": "none"
            }
        ],
        "locations": [
            {
                "name": "kuala lumpur",
                "sentiment": "none"
            },
            {
                "name": "padang terap",
                "sentiment": "none"
            },
            {
                "name": "kedah",
                "sentiment": "none"
            },
            {
                "name": "perak",
                "sentiment": "none"
            },
            {
                "name": "peninsula",
                "sentiment": "none"
            },
            {
                "name": "kuala muda",
                "sentiment": "none"
            },
            {
                "name": "kuala kangsar",
                "sentiment": "none"
            },
            {
                "name": "hulu perak",
                "sentiment": "none"
            },
            {
                "name": "malaysia",
                "sentiment": "none"
            },
            {
                "name": "langkawi",
                "sentiment": "none"
            },
            {
                "name": "kubang pasu",
                "sentiment": "none"
            }
        ]
    },
    "rating": null,
    "crawled": "2024-03-22T16:33:42.007+02:00",
    "updated": "2024-03-22T16:33:42.007+02:00"
}