{
    "thread": {
        "uuid": "264c48cef96d8dc2b1efa1fc601b597891c5e042",
        "url": "https://www.benningtonbanner.com/lifestyle/ct-wfo-boston-warnings-watches-and-advisories/article_886c17ad-7183-532e-9043-f6d058917a89.html",
        "site_full": "www.benningtonbanner.com",
        "site": "benningtonbanner.com",
        "site_section": "http://www.benningtonbanner.com/search/?f=rss&t=article&c=lifestyle&l=50&s=start_time&sd=desc",
        "site_categories": [
            "media"
        ],
        "section_title": "www.benningtonbanner.com - RSS Results in lifestyle of type article",
        "title": "CT WFO BOSTON Warnings, Watches, and Advisories",
        "title_full": "CT WFO BOSTON Warnings, Watches, and Advisories",
        "published": "2024-03-22T09:56:00.000+02:00",
        "replies_count": 0,
        "participants_count": 1,
        "site_type": "news",
        "country": "US",
        "main_image": "https://bloximages.newyork1.vip.townnews.com/benningtonbanner.com/content/tncms/custom/image/90f2e3da-429a-11ee-98fe-73f3cd906334.png?resize=600%2C315",
        "performance_score": 0,
        "domain_rank": 41105,
        "domain_rank_updated": "2024-03-19T12:08:01.000+02:00",
        "reach": null,
        "social": {
            "facebook": {
                "likes": 0,
                "comments": 0,
                "shares": 0
            },
            "gplus": {
                "shares": 0
            },
            "pinterest": {
                "shares": 0
            },
            "linkedin": {
                "shares": 0
            },
            "stumbledupon": {
                "shares": 0
            },
            "vk": {
                "shares": 0
            }
        }
    },
    "uuid": "264c48cef96d8dc2b1efa1fc601b597891c5e042",
    "url": "https://www.benningtonbanner.com/lifestyle/ct-wfo-boston-warnings-watches-and-advisories/article_886c17ad-7183-532e-9043-f6d058917a89.html",
    "ord_in_thread": 0,
    "parent_url": null,
    "author": "Accuweather",
    "published": "2024-03-22T09:56:00.000+02:00",
    "title": "CT WFO BOSTON Warnings, Watches, and Advisories",
    "text": "WFO BOSTON Warnings, Watches and Advisories for Sunday, March 24, 2024\nAREAL FLOOD WATCH\nURGENT - IMMEDIATE BROADCAST REQUESTED\nFlood Watch\nNational Weather Service Boston/Norton MA\n352 AM EDT Fri Mar 22 2024\n...FLOOD WATCH IN EFFECT FROM SATURDAY MORNING THROUGH SUNDAY\nMORNING...\n* WHAT...Flooding caused by excessive rainfall is possible.\n* WHERE...Portions of northern Connecticut, including the following\nareas, Hartford CT, Tolland CT and Windham CT, Massachusetts,\nincluding the following areas, Barnstable MA, Central Middlesex\nMA, Dukes MA, Eastern Essex MA, Eastern Hampden MA, Eastern\nNorfolk MA, Eastern Plymouth MA, Nantucket MA, Northern Bristol\nMA, Southeast Middlesex MA, Southern Bristol MA, Southern Plymouth\nMA, Southern Worcester MA, Suffolk MA, Western Essex MA, Western\nHampden MA, Western Norfolk MA and Western Plymouth MA, and Rhode\nIsland, including the following areas, Block Island RI, Bristol\nRI, Eastern Kent RI, Newport RI, Northwest Providence RI,\nSoutheast Providence RI, Washington RI and Western Kent RI.\n* WHEN...From Saturday morning through Sunday morning.\n* IMPACTS...Excessive runoff may result in flooding of rivers,\ncreeks, streams, and other low-lying and flood-prone locations.\nCreeks and streams may rise out of their banks. Flooding may occur\nin poor drainage and urban areas.\n* ADDITIONAL DETAILS...\n- Two to three inches of rainfall with locally higher amounts\nare expected Saturday into Saturday night. The heaviest rain\nwill occur Saturday afternoon and evening which may lead to\nurban and poor drainage street flooding as well as sharp\nrises on rivers and streams. Some river flooding is possible.\n-\nhttp://www.weather.gov/safety/flood\nPRECAUTIONARY/PREPAREDNESS ACTIONS...\nYou should monitor later forecasts and be alert for possible Flood\nWarnings. Those living in areas prone to flooding should be prepared\nto take action should flooding develop.\nCopyright 2024 AccuWeather",
    "highlightText": "",
    "highlightTitle": "",
    "highlightThreadTitle": "",
    "language": "english",
    "sentiment": "negative",
    "categories": [
        "Disaster and Accident",
        "Weather"
    ],
    "external_links": [
        "http://www.weather.gov/safety/flood",
        "http://weather.gov/safety/flood"
    ],
    "external_images": [],
    "entities": {
        "persons": [
            {
                "name": "nantucket ma",
                "sentiment": "none"
            },
            {
                "name": "dukes",
                "sentiment": "none"
            }
        ],
        "organizations": [
            {
                "name": "northern bristol ma",
                "sentiment": "none"
            },
            {
                "name": "eastern hampden ma",
                "sentiment": "none"
            },
            {
                "name": "barnstable ma",
                "sentiment": "none"
            },
            {
                "name": "western essex ma",
                "sentiment": "none"
            },
            {
                "name": "eastern plymouth ma",
                "sentiment": "none"
            },
            {
                "name": "flood watch national weather service boston/norton",
                "sentiment": "none"
            },
            {
                "name": "central middlesex ma",
                "sentiment": "none"
            },
            {
                "name": "southern worcester ma",
                "sentiment": "none"
            },
            {
                "name": "western plymouth ma",
                "sentiment": "none"
            },
            {
                "name": "southern plymouth ma",
                "sentiment": "none"
            },
            {
                "name": "southeast providence ri",
                "sentiment": "none"
            },
            {
                "name": "western hampden ma",
                "sentiment": "none"
            },
            {
                "name": "eastern essex ma",
                "sentiment": "none"
            },
            {
                "name": "hartford ct",
                "sentiment": "none"
            },
            {
                "name": "southern bristol ma",
                "sentiment": "none"
            },
            {
                "name": "northwest providence ri",
                "sentiment": "none"
            },
            {
                "name": "windham ct",
                "sentiment": "none"
            }
        ],
        "locations": [
            {
                "name": "boston",
                "sentiment": "none"
            },
            {
                "name": "rhode island",
                "sentiment": "none"
            },
            {
                "name": "tolland",
                "sentiment": "none"
            },
            {
                "name": "massachusetts",
                "sentiment": "none"
            },
            {
                "name": "bristol",
                "sentiment": "none"
            },
            {
                "name": "connecticut",
                "sentiment": "none"
            },
            {
                "name": "southeast middlesex ma",
                "sentiment": "none"
            },
            {
                "name": "suffolk ma",
                "sentiment": "none"
            },
            {
                "name": "washington",
                "sentiment": "none"
            }
        ]
    },
    "rating": null,
    "crawled": "2024-03-22T10:20:23.165+02:00",
    "updated": "2024-03-22T10:20:23.165+02:00"
}